{
  "$schema": "https://wandplus.dev/schema/v1/wand.schema.json",
  "version": "1.0",
  "kind": "changelog",
  "kindVersion": "1.0.0",
  "displayName": "Changelog",
  "description": "A release changelog. Two-phase linear flow: collect raw entries, then publish a formatted CHANGELOG.md. Use when the user wants to assemble or update a changelog or release notes.",
  "directoryContract": {
    "subdirTemplate": "wands/changelog/{wandId}",
    "requiredSubdirs": ["entries"]
  },
  "workflow": {
    "phaseFlowMode": "linear",
    "initialPhase": "collect",
    "phases": [
      {
        "id": "collect",
        "allowGlobs": ["entries/**"],
        "phaseGateCheck": {
          "mode": "script",
          "inputSchema": { "type": "object", "properties": {}, "additionalProperties": false }
        }
      },
      {
        "id": "publish",
        "allowGlobs": ["CHANGELOG.md"],
        "cleanupOnRewind": ["CHANGELOG.md"],
        "phaseGateCheck": {
          "mode": "script",
          "inputSchema": {
            "type": "object",
            "properties": { "version": { "type": "string" } },
            "required": ["version"],
            "additionalProperties": false
          }
        }
      }
    ]
  }
}
